{"schemaVersion":1,"generatedBy":"qa-init@0.1.0","generatedAt":"2026-07-18T10:15:00Z","repository":{"root":".","monorepo":false,"packages":[]},"language":{"primary":"typescript","others":["javascript"]},"runtime":{"node":"20.x"},"packageManager":"pnpm","buildTool":null,"testFramework":{"unit":null,"e2e":"playwright","bdd":null},"browserAutomation":{"tool":"playwright","mcp":false},"apiStyles":["rest"],"ci":{"provider":"github-actions","workflows":[".github/workflows/ci.yml"]},"conventions":{"testDir":"e2e","specGlob":"e2e/**/*.spec.ts","configFiles":["playwright.config.ts"]},"existingAutomation":true,"confidence":"high"}
