{
  "schemaVersion": 1,
  "generatedBy": "qa-init@0.2.0",
  "generatedAt": "2026-07-24T10:00:00Z",
  "repository": { "root": ".", "monorepo": false, "packages": [] },
  "language": { "primary": "typescript", "others": ["javascript"] },
  "packageManager": "npm",
  "buildTool": null,
  "testFramework": { "unit": null, "e2e": "playwright", "bdd": null },
  "browserAutomation": { "tool": "playwright", "mcp": false },
  "apiStyles": [],
  "ci": { "provider": null, "workflows": [] },
  "conventions": { "testDir": "tests", "specGlob": "tests/**/*.spec.ts", "configFiles": ["playwright.config.ts"] },
  "existingAutomation": true,
  "confidence": "high"
}
